{
 "$schema": "./schema/batterylake-research-index-2.0.json",
 "schema_version": "2.0.0",
 "generated": "2026-10-14",
 "record_schema": "./schema/batterylake-research-2.0.json",
 "count": 40,
 "facets": {
  "category": [
   "calendar_aging",
   "characterization",
   "cycle_aging",
   "eis",
   "ev",
   "field_data",
   "field_fault_diagnosis",
   "soc_estimation",
   "soh_estimation",
   "thermal_runaway"
  ],
  "suitable_tasks": [
   "EIS_characterization",
   "OCV_curve_extraction",
   "RUL_prediction",
   "SOC_estimation",
   "SOH_estimation",
   "digital_twin_calibration",
   "fault_diagnosis",
   "simulation",
   "synthetic_data_generation",
   "thermal_modelling"
  ],
  "source_confidence": [
   "verified"
  ]
 },
 "datasets": [
  {
   "dataset_id": "dataset_01",
   "category": "cycle_aging",
   "record_path": "research/dataset_01.json",
   "complete_v_i_t_timeseries": true,
   "soc_computable": true,
   "soh_computable": true,
   "capacity_degradation_present": true,
   "ocv_present": false,
   "internal_resistance_present": false,
   "eis_present": true,
   "thermal_characterization": false,
   "suitable_tasks": [
    "SOH_estimation",
    "RUL_prediction",
    "SOC_estimation",
    "digital_twin_calibration",
    "simulation",
    "synthetic_data_generation",
    "EIS_characterization"
   ],
   "source_confidence": "verified"
  },
  {
   "dataset_id": "dataset_02",
   "category": "cycle_aging",
   "record_path": "research/dataset_02.json",
   "complete_v_i_t_timeseries": false,
   "soc_computable": true,
   "soh_computable": true,
   "capacity_degradation_present": true,
   "ocv_present": false,
   "internal_resistance_present": true,
   "eis_present": false,
   "thermal_characterization": false,
   "suitable_tasks": [
    "SOH_estimation",
    "RUL_prediction",
    "SOC_estimation",
    "digital_twin_calibration"
   ],
   "source_confidence": "verified"
  },
  {
   "dataset_id": "dataset_03",
   "category": "cycle_aging",
   "record_path": "research/dataset_03.json",
   "complete_v_i_t_timeseries": true,
   "soc_computable": true,
   "soh_computable": true,
   "capacity_degradation_present": true,
   "ocv_present": false,
   "internal_resistance_present": true,
   "eis_present": false,
   "thermal_characterization": false,
   "suitable_tasks": [
    "SOH_estimation",
    "RUL_prediction",
    "SOC_estimation",
    "digital_twin_calibration",
    "simulation",
    "synthetic_data_generation"
   ],
   "source_confidence": "verified"
  },
  {
   "dataset_id": "dataset_04",
   "category": "cycle_aging",
   "record_path": "research/dataset_04.json",
   "complete_v_i_t_timeseries": false,
   "soc_computable": false,
   "soh_computable": true,
   "capacity_degradation_present": true,
   "ocv_present": true,
   "internal_resistance_present": false,
   "eis_present": false,
   "thermal_characterization": false,
   "suitable_tasks": [
    "SOH_estimation",
    "OCV_curve_extraction"
   ],
   "source_confidence": "verified"
  },
  {
   "dataset_id": "dataset_05",
   "category": "cycle_aging",
   "record_path": "research/dataset_05.json",
   "complete_v_i_t_timeseries": false,
   "soc_computable": true,
   "soh_computable": true,
   "capacity_degradation_present": true,
   "ocv_present": false,
   "internal_resistance_present": true,
   "eis_present": false,
   "thermal_characterization": false,
   "suitable_tasks": [
    "SOH_estimation",
    "RUL_prediction",
    "SOC_estimation",
    "digital_twin_calibration",
    "simulation",
    "synthetic_data_generation"
   ],
   "source_confidence": "verified"
  },
  {
   "dataset_id": "dataset_06",
   "category": "cycle_aging",
   "record_path": "research/dataset_06.json",
   "complete_v_i_t_timeseries": false,
   "soc_computable": true,
   "soh_computable": true,
   "capacity_degradation_present": true,
   "ocv_present": false,
   "internal_resistance_present": false,
   "eis_present": false,
   "thermal_characterization": false,
   "suitable_tasks": [
    "SOH_estimation",
    "RUL_prediction",
    "SOC_estimation",
    "digital_twin_calibration",
    "simulation",
    "synthetic_data_generation"
   ],
   "source_confidence": "verified"
  },
  {
   "dataset_id": "dataset_07",
   "category": "cycle_aging",
   "record_path": "research/dataset_07.json",
   "complete_v_i_t_timeseries": false,
   "soc_computable": true,
   "soh_computable": true,
   "capacity_degradation_present": true,
   "ocv_present": false,
   "internal_resistance_present": false,
   "eis_present": false,
   "thermal_characterization": false,
   "suitable_tasks": [
    "SOH_estimation",
    "RUL_prediction",
    "SOC_estimation",
    "digital_twin_calibration"
   ],
   "source_confidence": "verified"
  },
  {
   "dataset_id": "dataset_08",
   "category": "cycle_aging",
   "record_path": "research/dataset_08.json",
   "complete_v_i_t_timeseries": true,
   "soc_computable": true,
   "soh_computable": true,
   "capacity_degradation_present": true,
   "ocv_present": false,
   "internal_resistance_present": false,
   "eis_present": false,
   "thermal_characterization": false,
   "suitable_tasks": [
    "SOH_estimation",
    "RUL_prediction",
    "SOC_estimation",
    "digital_twin_calibration",
    "simulation",
    "synthetic_data_generation"
   ],
   "source_confidence": "verified"
  },
  {
   "dataset_id": "dataset_09",
   "category": "cycle_aging",
   "record_path": "research/dataset_09.json",
   "complete_v_i_t_timeseries": true,
   "soc_computable": true,
   "soh_computable": true,
   "capacity_degradation_present": true,
   "ocv_present": false,
   "internal_resistance_present": false,
   "eis_present": false,
   "thermal_characterization": false,
   "suitable_tasks": [
    "SOH_estimation",
    "RUL_prediction",
    "SOC_estimation",
    "digital_twin_calibration",
    "simulation",
    "synthetic_data_generation"
   ],
   "source_confidence": "verified"
  },
  {
   "dataset_id": "dataset_11",
   "category": "cycle_aging",
   "record_path": "research/dataset_11.json",
   "complete_v_i_t_timeseries": true,
   "soc_computable": true,
   "soh_computable": true,
   "capacity_degradation_present": true,
   "ocv_present": true,
   "internal_resistance_present": true,
   "eis_present": false,
   "thermal_characterization": false,
   "suitable_tasks": [
    "SOH_estimation",
    "SOC_estimation",
    "digital_twin_calibration",
    "simulation",
    "synthetic_data_generation",
    "OCV_curve_extraction"
   ],
   "source_confidence": "verified"
  },
  {
   "dataset_id": "dataset_12",
   "category": "ev",
   "record_path": "research/dataset_12.json",
   "complete_v_i_t_timeseries": false,
   "soc_computable": true,
   "soh_computable": false,
   "capacity_degradation_present": false,
   "ocv_present": false,
   "internal_resistance_present": false,
   "eis_present": false,
   "thermal_characterization": false,
   "suitable_tasks": [
    "SOC_estimation",
    "digital_twin_calibration",
    "simulation",
    "fault_diagnosis"
   ],
   "source_confidence": "verified"
  },
  {
   "dataset_id": "dataset_13",
   "category": "field_data",
   "record_path": "research/dataset_13.json",
   "complete_v_i_t_timeseries": true,
   "soc_computable": true,
   "soh_computable": true,
   "capacity_degradation_present": true,
   "ocv_present": true,
   "internal_resistance_present": true,
   "eis_present": false,
   "thermal_characterization": false,
   "suitable_tasks": [
    "SOH_estimation",
    "SOC_estimation",
    "digital_twin_calibration",
    "simulation",
    "synthetic_data_generation",
    "OCV_curve_extraction"
   ],
   "source_confidence": "verified"
  },
  {
   "dataset_id": "dataset_14",
   "category": "characterization",
   "record_path": "research/dataset_14.json",
   "complete_v_i_t_timeseries": true,
   "soc_computable": true,
   "soh_computable": false,
   "capacity_degradation_present": false,
   "ocv_present": false,
   "internal_resistance_present": true,
   "eis_present": true,
   "thermal_characterization": false,
   "suitable_tasks": [
    "SOC_estimation",
    "digital_twin_calibration",
    "simulation",
    "synthetic_data_generation",
    "EIS_characterization"
   ],
   "source_confidence": "verified"
  },
  {
   "dataset_id": "dataset_15",
   "category": "field_data",
   "record_path": "research/dataset_15.json",
   "complete_v_i_t_timeseries": false,
   "soc_computable": true,
   "soh_computable": false,
   "capacity_degradation_present": false,
   "ocv_present": false,
   "internal_resistance_present": false,
   "eis_present": false,
   "thermal_characterization": false,
   "suitable_tasks": [
    "SOC_estimation",
    "digital_twin_calibration",
    "simulation"
   ],
   "source_confidence": "verified"
  },
  {
   "dataset_id": "dataset_16",
   "category": "soh_estimation",
   "record_path": "research/dataset_16.json",
   "complete_v_i_t_timeseries": true,
   "soc_computable": true,
   "soh_computable": true,
   "capacity_degradation_present": false,
   "ocv_present": false,
   "internal_resistance_present": false,
   "eis_present": false,
   "thermal_characterization": false,
   "suitable_tasks": [
    "SOH_estimation",
    "SOC_estimation",
    "digital_twin_calibration",
    "simulation",
    "synthetic_data_generation"
   ],
   "source_confidence": "verified"
  },
  {
   "dataset_id": "dataset_17",
   "category": "cycle_aging",
   "record_path": "research/dataset_17.json",
   "complete_v_i_t_timeseries": true,
   "soc_computable": true,
   "soh_computable": true,
   "capacity_degradation_present": true,
   "ocv_present": false,
   "internal_resistance_present": false,
   "eis_present": false,
   "thermal_characterization": false,
   "suitable_tasks": [
    "SOH_estimation",
    "SOC_estimation",
    "digital_twin_calibration",
    "simulation",
    "synthetic_data_generation"
   ],
   "source_confidence": "verified"
  },
  {
   "dataset_id": "dataset_18",
   "category": "cycle_aging",
   "record_path": "research/dataset_18.json",
   "complete_v_i_t_timeseries": false,